{"artifact_identity": "sha256:8e554bca6e1c00781d1ee15cac2b4644c656e1a7becd13617eb4d46382e7096d", "diagnostics": [{"code": "artifact-rights-unresolved", "evidence_ref": "#/rights/contributing_manifests", "remedy": "resolve-rights-evidence-or-preserve-unresolved-state", "severity": "review", "summary": "At least one contributing rights declaration remains unresolved."}], "legal_conclusion": "NOT_MADE", "schema_version": "mncs.rights-provenance.artifact-binding-diagnostic/0.1.0", "status": "review"}
